,phrase,intents
1227,"I cant answer a call right now. I talked to someone from vivint a xou0le of days ago. I love the service but the price is a lot higher than i expected. He quoted me 70 a month, equipment costing $1,400. Then we added my husband and we got $40 a month (which is great) but equipment went up to $3000. So I dont see the best offer","[""2.cost.too.high"", ""2.transfer.success"", ""0.delay.hours""]"
1228,"Hi [NAME_1], I have ADT coming out to my house on the 23rd to see about customizing a plan and to check the house out for FREE. FREE consultation no fee to come out, if you can give me the same offer I will be more likely to incline to see if what you guys have to offer will fit my family and home","[""0.cost.demand"", ""0.greeting"", ""2.chose.competitor""]"
1229,I'm no longer interested in switching security systems.  You can cease texting and emailing me.  Thank you.,"[""0.courtesy.or.statement"", ""2.dnc"", ""2.not.interested""]"
1230,The problem with Vivint is $50 a month I only want to pay $10 a month we already have the sensors in our home and the camera on our front doorbell,"[""0.cost.demand"", ""0.existing.system"", ""2.cost.too.high""]"
1231,Hello i never submitted my phone number to this company. Stop calling me. Or I will complain in local authorities,"[""2.dnc"", ""0.greeting""]"
1232,Already got a couple of quotes-If you can give me a break on the hardware cost while still keeping my monthly fee around $50 a month I'll buy today.,"[""0.promo.info"", ""2.transfer.success"", ""1.is.interested"", ""0.cost.demand""]"
1233,"Hi [NAME_1], thank you for reaching out.  We will actually be staying with Adt as they were able to lower their monthly rate. Plus we are in a contract till 2024.","[""0.courtesy.or.statement"", ""2.in.contract"", ""0.greeting"", ""2.chose.competitor""]"
1234,"Thank you but I have a person that I'm  working with at Vivint, just waiting to move in on the 1st of Nov","[""0.courtesy.or.statement"", ""2.transfer.success"", ""0.delay.new.house""]"
1235,Hi [NAME_1] I got a quote from Vivint of over four thousand dollars for there equipment I found that price ridiculous especially that I could only use this equipment only with a Vivint system I decide to go with ADT alarm system,"[""2.transfer.success"", ""0.greeting"", ""2.cost.too.high"", ""2.chose.competitor""]"
1236,I live in two houses worth more than a million. The point is I make no decisions regarding improvement and repair matters. Contact my parents please.,"[""0.home.specifications"", ""0.info.for.someone.else""]"
1237,"I talked to specialist and nobody gave me the cost, here is the information I have and let me know the cost . The house is 5300 sq ft, we would like to have three outdoor cameras including the one for doorbells-two ways talk. Motion detector, 3 sets door window sensors","[""0.specific.equipment.cost"", ""2.transfer.success"", ""0.home.specifications"", ""0.what.does.it.cost""]"
1238,"Yes you can call, question  Is this free installation and nothing out of pocket or what I just need to know","[""0.promo.info"", ""0.confirmation"", ""0.what.does.it.cost"", ""1.call.now""]"
1239,"Hi [NAME_1], I'm traveling today and will be back tomorrow. Can we connect then? We'd like to explore the doorbell and a couple cameras","[""0.specific.equipment.cost"", ""0.greeting""]"
1240,"Yes, just waiting to make sure the mortgage goes thru first, should know by the 10th. Shopping around currently. 
Looking for a monitored system that can have three entry alarms, 2 doorbell cameras, an indoor camera and 2-3 outdoor cameras.","[""0.delay.evaluating"", ""1.schedule.call.day_n_time"", ""0.specific.equipment.cost"", ""0.delay.finances""]"
1241,I've already received a quote from you it was $4000. I want 40% off the $4000 if you can offer that to me I'm ready to sign up,"[""0.cost.demand"", ""2.transfer.success""]"
1242,"I am looking to put outdoor cameras up around the barn and house. A front door camera at house. Is this something you do?
What is the cost?","[""0.how.does.it.work"", ""0.specific.equipment.cost"", ""0.what.does.it.cost""]"
1243,"Hi.. is the special still available where I get the system, the doorbell, and the thermostat? If not what do you all have?","[""0.promo.info"", ""0.greeting""]"
1244,I already talked to someone and found out the deal I wanted 5 sensors a smart lock and an outdoor camera but they said it would be over 70 per month we just can't afford that right now,"[""2.transfer.success"", ""2.needs.income""]"
1245,Yes I will have the money to pay for first installment on Tuesday. Would you like to speak on Tuesday?,"[""1.schedule.call.day_n_time"", ""0.greeting"", ""0.delay.finances""]"
1246,Hi [NAME_1] this is [NAME_2]; my brother bought a front door alarm from your company with free installation and a $5 a month for service. If you have that available that's what I need. Thanks,"[""0.cost.demand"", ""0.courtesy.or.statement"", ""0.greeting"", ""1.is.interested""]"
1247,"Thank you, but I'm not interested. Im not comfortable paying $3000 for equipment. Please take me off the list. Thank you","[""0.courtesy.or.statement"", ""2.dnc"", ""2.not.interested"", ""2.needs.income""]"
1248,I looked at your systems online and sadly the system I would need is more than I can afford upfront not to mention I JUST became eligible for 4K Internet which works great but I'm worried if it didn't work  properly I'd be locked into a contract,"[""0.courtesy.or.statement"", ""0.about.contract"", ""2.needs.income""]"
1249,No i cannot. I will not be able to get what i had tried to order. Some things came up and i need to cancel,"[""0.negation"", ""2.needs.income""]"
1250,Oh. I'm sorry. I was doing something and didn't recognize the number. You can call me back if you have time,"[""1.call.now"", ""0.apology""]"
1251,Right. My phone won't let me pick up we  text  put phone down for pick up  it be couple day. I see calling put it won't let talk the phone company still working,"[""0.confirmation"", ""0.text.only""]"
1252,"Hello [NAME_1], thank you for the chance to talk. What is required for a qoute? We live in a triple wide mobile with a dettached 6 car garage.","[""0.courtesy.or.statement"", ""0.greeting"", ""0.home.specifications""]"
1253,We are looking for security service that will be able to use our key pads and hardwired sensors that have been installed on our new [LOCATION_1] home.,"[""0.existing.system"", ""1.is.interested"", ""0.new.home""]"
1254,I'm sorry I'm at work but I just don't have the money right now to get it! I mean I'll be able to pay every month but I just don't have it to get today!,"[""0.delay.finances"", ""0.delay.work"", ""0.apology""]"
1255,Hey there! Thanks for reaching out. We are in the process of buying a house and don't need the system yet. i will reach out when the time is right. Thank you!,"[""0.courtesy.or.statement"", ""0.delay.conditional"", ""0.greeting"", ""0.delay.new.house""]"
1256,"I am sorry to inform you that you are sending messages to the wrong person and phone number for [NAME_1]. I have no knowledge of who that is.Please check for the correct number in the future, Thank You.","[""0.courtesy.or.statement"", ""2.wrong.number""]"
1257,Well the price quoted was a little too high for me. I'm looking for service in the $40-50 range a month.,"[""0.cost.demand"", ""2.cost.too.high""]"
1258,"I appreciate your continued follow up as we remain in need of an alarm / camera system.  Our challenge with your company is that there is not a representative in our area that can install the system, program our phones and be responsive if there is ever a service issue.  All DIY and we are not technology or DIY people.","[""0.courtesy.or.statement"", ""1.is.interested""]"
1259,Sorry I totally forgot about the call coming back from work during the traffic. What is the best time to call you later tonight.,"[""0.agent.contact.info"", ""0.apology""]"
1260,"Thank You for contacting after hours MDVita Support, at this time we cannot take your call, send an email to [EMAIL_ADDRESS_1] or call [PHONE_NUMBER_1]. Thanks","[""0.courtesy.or.statement"", ""0.send.info"", ""0.info.for.someone.else"", ""0.delay.hours""]"
1261,My apologies I have already spoken with someone about the prices and details of everything and decided to go with someone else but I appreciate your service,"[""0.courtesy.or.statement"", ""2.transfer.success"", ""0.apology"", ""2.chose.competitor""]"
1262,I really would like to know about what kind of money we r talking about to get it installed and working for a three room home three doors 6 windows and the outside garage building all as one unit,"[""0.what.does.it.cost"", ""0.home.specifications""]"
1263,"Already discussed and was ""d like a $[MONEY_1] way too much money when there's way cheaper options out there","[""2.transfer.success"", ""2.cost.too.high""]"
1264,I am in a contract with [ORGANIZATION_1] and they asked me to pay $[MONEY_1] for early termination. I wanted a different system but don't want to lose all that money,"[""2.needs.income"", ""1.is.interested"", ""2.in.contract""]"
1265,Please don't call or text me again if i want your services i will reach out to you.  This is harassment calling me everyday.  The next step i take will involve my [OCCUPATION_1].,"[""2.dnc"", ""0.delay.conditional"", ""0.excessive.contact""]"
1266,We were ready to sign last week but you guys couldn't get us on a monthly payment plan. It's a no go unless that can happen.,"[""0.about.contract"", ""1.is.interested""]"
1267,I do not have a specific price in mind the system that we wanted was going to be like $[MONEY_1] or $[MONEY_2] and we don't have that to pay. We would need a monthly payment plan.,"[""0.about.contract"", ""2.needs.income""]"
1268,"Thank you all for your endless persistence and calling and texting me. LOL

We are building a home in [LOCATION_1], that will be a second home. I am investigating security systems, cameras, etc. So first of all [LOCATION_2] area you serve?","[""0.delay.evaluating"", ""0.excessive.contact"", ""0.new.home""]"
1269,Hey there i work during the day...usually get out around [TIME_1] every day...if i have time this aafternoon ill try to gwt ahold of [NAME_1],"[""1.schedule.call.day_n_time"", ""0.delay.conditional"", ""0.delay.work""]"
1270,Yes! I called my security company and my contract doesn't run out until [DATE_1].  Very excited to get off them,"[""2.future.interest"", ""2.in.contract""]"
1271,We already have the equipment as we were prior customers. The problem is your service is too expensive compared to other services.,"[""0.existing.system"", ""2.cost.too.high""]"
1272,Sorry I work for the school district and always in and out of mtgs. I'm off at 5 and will b home by 530.,"[""1.schedule.call.day_n_time"", ""0.delay.work"", ""0.apology""]"
1273,I Have thing in the mail for 4 months free monitoring and free installation. I wish i could look up the prices on line,"[""0.promo.info"", ""0.what.does.it.cost""]"
1274,Ok I just wanted to know about the home security system but I live in an apartments. Let me check my schedule,"[""0.confirmation"", ""0.delay.will.reply"", ""1.is.interested""]"
1275,"I'm sorry I'm at work currently, but after speaking with your guy last week, getting a system is a little out of our price range at this time.","[""2.transfer.success"", ""0.delay.work"", ""0.apology"", ""2.needs.income""]"
1276,"Now is not a good time
I'm at work. I get off at 5:00. If it's any way you can contact me after that, that would be good. If not I will try to contact you on my lunch which I'm not sure what time I'll be going","[""0.delay.will.reply"", ""1.schedule.call.day_n_time"", ""0.delay.work"", ""0.delay.hours""]"
1277,"Hey [NAME_1] thanks for reaching out. So we have VIVINT I was just interested in home automation. Mainly the AC and the garage opener controls. My wife added me on the app and I was now able to see the options. 
Do you have an specials right now to help add these to our plan?","[""0.specific.equipment.cost"", ""0.greeting"", ""0.promo.info"", ""0.courtesy.or.statement""]"
1278,Well [NAME_1] why don't you come to my house and measure it up and I want some cameras and let's see how much it is a month,"[""0.specific.equipment.cost"", ""0.what.does.it.cost""]"
1279,When is a good time for you? I have just one question first. How much is the average set up? Also my friend referred me,"[""0.promo.info"", ""0.agent.contact.info"", ""0.what.does.it.cost""]"
1280,"I'm going to do it after I close on my house at the end of the month, you think you could call me then?","[""1.is.interested"", ""0.delay.new.house""]"
1281,Honey with the death of my husband so suddenly I'm not going to be able to do anything like we wanted I'm sorry for waiting your time thanks,"[""0.delay.funeral"", ""0.courtesy.or.statement"", ""2.not.interested"", ""0.apology""]"
1282,"Ok, ADT is giving me the equipment no charge and 59 dollars a month monitoring fee and I pay for two extra cameras. But I'm getting everything I want.  You guys don't offer that. So thanks but no thanks.","[""0.confirmation"", ""2.not.interested"", ""2.chose.competitor""]"
1283,I just need a ballpark price of what it may cost. We are a retired couple on a tight budget for seniors.,"[""0.promo.info"", ""0.what.does.it.cost""]"
1284,Im so sorry I haven't got back to u the streets are crazy no I dont need assistance thanks throw Im a K-9 HANDLER but I really got to get back to u ok Im sorry things are taking so long.,"[""0.delay.will.reply"", ""2.not.interested"", ""0.apology""]"
1285,I talk to someone a couple days ago..they said I had to pay 2 hundred and something but I thought it was $0 installment.  I may can see what I can do tomorrow,"[""0.promo.info"", ""2.transfer.success"", ""2.cost.too.high""]"
1286,"[NAME_1], I have decided to go with a different home security system. I was not able to do anything close to $95/month at this time","[""2.needs.income"", ""2.chose.competitor""]"
1287,I already said I was not interested anymore. I have unsubscribed from all emails and I have replied STOP to all other text messages.  Please remove my number from your list.,"[""2.dnc"", ""2.not.interested""]"
1288,I will call your company as soon as I have free time available. What are the hours of operation for the [ORGANIZATION_1].?,"[""0.agent.contact.info"", ""0.delay.conditional""]"
1289,I have already spoken to 1 of your representatives and told them I was no longer interested. So please remove me from your contact list,"[""2.dnc"", ""2.transfer.success"", ""2.not.interested""]"
1290,I actually spoke with someone else and you guys are to expensive. I ended going with [ORGANIZATION_1] which is top 3 in the nation and so much cheaper,"[""2.transfer.success"", ""2.cost.too.high"", ""2.chose.competitor""]"
1291,"Hello [NAME_1], I'm no longer interested in a [ORGANIZATION_1] system. Can you please take me off of your call list. Thank you!","[""0.courtesy.or.statement"", ""2.dnc"", ""0.greeting"", ""2.not.interested""]"
1292,I wasn't approved and I'm not paying the costs upfront. Please remove me from the contact list. Thank you,"[""0.courtesy.or.statement"", ""2.dnc"", ""2.needs.income"", ""2.credit.denied""]"
1293,I am no longer interested. I have gone with a different company. Can you please remove my contact information from the call list?,"[""2.dnc"", ""2.not.interested"", ""2.chose.competitor""]"
1294,"Already spoke to someone last Friday, I am no longer interested in getting this system, please remove my name from your list. Thanks","[""0.courtesy.or.statement"", ""2.dnc"", ""2.transfer.success"", ""2.not.interested""]"
1295,Hey there! I actually spoke on the phone to someone and it was the same price as my current provider so I'm gonna stick with what I have. Thank you!!,"[""0.courtesy.or.statement"", ""2.transfer.success"", ""0.greeting"", ""2.chose.competitor""]"
1296,Problem is not with the system but in how much it cost each month. I think the price was a little too much. Maybe there are other options,"[""0.promo.info"", ""2.cost.too.high""]"
1297,"I prefer Sunday evening around [TIME_1]. Bcuz after working over 14 hours, I will be interested in sleeping","[""0.courtesy.or.statement"", ""1.schedule.call.day_n_time""]"
1298,Hi- I Wasn't looking for a high monthly fee set up given I have a system already. I want to pay max $[MONEY_1]. So please remove me from your list  for the time being.,"[""0.existing.system"", ""2.cost.too.high"", ""0.greeting"", ""0.cost.demand"", ""2.dnc""]"
1299,No I'm on the [LOCATION_1] I'm in [LOCATION_2] it's [TIME_1] of nine I'm good for the next hour if you can give me a call,"[""0.negation"", ""1.schedule.call.day_n_time"", ""1.call.now""]"
1300,"Next week sometime please continue text me.

Need to speak to my wife.

Can you send text or email with prices??","[""0.delay.evaluating"", ""0.what.does.it.cost""]"
1301,The house I just purchased already has a Vivint security system that's not active. I need to understand what it would take to activate it. I'm busy at work until Friday so maybe we can talk Friday.,"[""0.existing.system"", ""1.schedule.call.day_n_time"", ""0.delay.work""]"
1302,"Hi [NAME_1]? Are you able to discuss the options via text, by any chance? Has the price changed any from the original quote?","[""0.text.only"", ""0.greeting"", ""0.what.does.it.cost""]"
1303,"I can assure you, based on yo predatory and harassing practices, your services will not be utilized. Remove me from all sources and do not contact me further.","[""2.dnc"", ""2.not.interested"", ""0.excessive.contact""]"
1304,They said I didn't qualify for that afre I was on the phone for half an hour with the [OCCUPATION_1],"[""2.transfer.success"", ""2.not.eligible""]"
1305,I can't switch I am still under contract with my previous provider and they want to much $$ for buyout,"[""2.needs.income"", ""2.in.contract""]"
1306,"Ofcourse I need a good quality 
 What kind of financing you are talking about?
If you're not able to answer my questions 
I'm not interested anymore 
Thanks","[""0.courtesy.or.statement"", ""2.not.interested"", ""0.buy.equipment""]"
1307,"Hi [NAME_1], I'm no longer interested. We are looking for a system that does not require a monthly expense.","[""0.cost.demand"", ""0.greeting"", ""2.not.interested""]"
1308,No thanks. I no longer need it. Can I have my number removed please? I receive too many phone calls and texts.,"[""2.dnc"", ""2.not.interested"", ""0.excessive.contact""]"
1309,It's you can't email me anything to review I don't think we are a good fit and I will pursue elsewhere.  Please remove me from your call list,"[""2.dnc"", ""0.send.info"", ""2.not.interested""]"
1310,"Good morning. 
I need 2 door sensors, two outside cameras and one inside. With all that is included with the alarm system. What is the price $ of the equipments and monthly charge. ??","[""0.specific.equipment.cost"", ""0.greeting"", ""0.what.does.it.cost""]"
1311,Hello we have not yet closed on our new house so when I talked to the salesperson before he suggested waiting until we took occupancy as we are still deciding if we will get a security system or not. Please checkin in mid November,"[""2.future.interest"", ""2.transfer.success"", ""0.greeting"", ""0.delay.evaluating"", ""0.delay.new.house""]"
1312,"No thank you, I got the ring doorbell for a better price. No payments every month,  thanks [NAME_1] and enjoy your day 🙂","[""0.courtesy.or.statement"", ""2.not.interested"", ""2.cost.too.high"", ""2.chose.competitor""]"
1313,Hi! Can I call sometime this afternoon? I need an installation for the back door sensor and information on the sensors that are active in my home,"[""0.existing.system"", ""1.schedule.call.day_n_time"", ""0.greeting"", ""0.specific.equipment.cost""]"
1314,I've already told another sales person from your company I'm not interested. Please don't contact me anymore,"[""2.dnc"", ""2.transfer.success"", ""2.not.interested""]"
1315,I told someone else with Vivint that we are no longer interested please. Already had another system installed.,"[""2.transfer.success"", ""2.not.interested"", ""2.chose.competitor""]"
1316,Just tlk to my buddy having a problem with y'all payment it's less then [AGE_1] then his  he  has y'all whole systems!!  We was using my own sensors and two inside cameras and door bell  monthly payment is high just for this,"[""0.cost.demand"", ""2.cost.too.high""]"
1317,I'm not interested and would appreciate it if you stopped contacting me. It's borderline harassment at this point,"[""2.dnc"", ""2.not.interested"", ""0.excessive.contact""]"
1318,We had a [ORGANIZATION_1] [OCCUPATION_1] at the house and this is not the direction we chose.  Thank you,"[""0.courtesy.or.statement"", ""2.transfer.success"", ""2.not.interested""]"
1319,My husband and I are going to pass. Didn't  realize we had to purchase  the items. And pay for the services. Thought they would be in one price. But thank you for your help and time,"[""2.not.interested"", ""2.cost.too.high"", ""0.no.monitoring""]"
1320,I literally just told you I can talk on Monday at [TIME_1]. I am at work and the amount of phone calls I have been getting are absurd.,"[""1.schedule.call.day_n_time"", ""0.delay.work"", ""0.excessive.contact""]"
1321,Probably not for at least a week. My Father is very ill and I can't do anything at this time. I will contact you.,"[""0.delay.family.sick"", ""0.delay.will.reply""]"
1322,I have already installed the smart home camera system from someone else thank you. Please stop calling me.,"[""2.dnc"", ""2.chose.competitor""]"
1323,"I'm currently in the process of purchasing a home but closing is not until [DATE_1],  after this date I'll be open to getting a quote","[""1.schedule.call.day_n_time"", ""0.delay.new.house""]"
1324,Apparently you cannot service my home since you only do cameras with Security. And I already have a security system with ADT. Thank you so much.,"[""0.courtesy.or.statement"", ""0.no.monitoring"", ""2.chose.competitor""]"
1325,"I want to go with your best package.  Camera, thermostat, touch pad for door lock & multiple cameras.  
I have to look again at your packages.  
If not Christmas Eve then next week after Tuesday I'll be off work.  It's end of the year for us at work an it's insanely busy","[""0.delay.evaluating"", ""0.specific.equipment.cost"", ""1.schedule.call.day_n_time""]"
1326,Are you willing to give me a no-cost written proposal? If not please remove me. If so please respond yes and we can move forward. Thank you for your text.,"[""0.courtesy.or.statement"", ""0.send.quote"", ""1.is.interested""]"
1327,Will you please stop harassing me?  I stopped talking to the other guy because he would not shop calling. Delete my number from your system,"[""2.dnc"", ""0.excessive.contact""]"
1328,We are selling our house and moving out of state. I will give you a call once we find our next home.,"[""0.delay.conditional"", ""0.delay.new.house""]"
1329,"I don't want to waste yours or my time.  If you can offer me free equipment you can have someone call now, but if they first thing that comes out of their mouth isn't, we can offer all the equipment free, I'm just going to hang up.","[""0.promo.info"", ""1.call.now""]"
1330,Good morning [NAME_1].. I work third shift so I'm not able to get to my phone sometimes during the day because I'm at work from night into the day and I sleep during the day sometimes,"[""0.greeting"", ""0.delay.work""]"
1331,Sorry but we won't be moved into new house until [DOB_1] so we can't do anything until after that day.,"[""2.future.interest"", ""0.delay.new.house""]"
1332,Thank you for getting back to me but I am not interested in a system that's gonna cost me a monthly fee thank you so much please stop contacting me,"[""0.courtesy.or.statement"", ""2.dnc"", ""2.not.interested""]"
1333,"Hi [NAME_1], I'm waiting to close on my house, we are hoping for the 19th of next month, please stay in touch","[""0.greeting"", ""1.is.interested"", ""0.delay.new.house""]"
1334,"Hi. 
 we are on our way to our new house. We are moving from out of state. 

Question we are renting .. Will a security system be able to take off without damaging?","[""0.greeting"", ""0.new.home""]"
1335,"Hi [NAME_1], I've already spoken to someone and as well as my husband has too.  We are still locked in our contact with ADT for 23 more months.  If you can help us get out of it and pay a huge fee then will are more than happy to go with Vivint.  Believe me we want to","[""2.transfer.success"", ""0.greeting"", ""1.is.interested"", ""2.in.contract""]"
1336,"I can't talk verbally  right now I'm at work
How much is it a month and what all comes with it please?","[""0.text.only"", ""0.how.does.it.work"", ""0.what.does.it.cost"", ""0.delay.work""]"
1337,If you can offer me a lower monthly and a clear cost of what the initial price would be I would like to sign up today,"[""0.cost.demand"", ""0.what.does.it.cost"", ""1.is.interested""]"
1338,I have a system that is non activated. It came with the house i just bought. My concern right now is that my doorbell doesn't work i think because your system is on it inactivated. I'd really like to have my doorbell back.,"[""1.is.interested"", ""0.existing.system"", ""0.new.home""]"
1339,Your package is too expensive for us according to our credit when we spoke to your customer service. But thank you,"[""0.courtesy.or.statement"", ""2.transfer.success"", ""2.needs.income"", ""2.credit.denied""]"
1340,"[ORGANIZATION_1]
I cannot agree to a contract especially for the monitoring fee that your company requires.","[""0.about.contract"", ""0.no.monitoring""]"
1341,"We are looking for the most least expensive solution to prevent [CONDITION_1], window breakage and theft prevention  for a 1br small condominium only 616 safest and easy on off arrangement.","[""0.specific.equipment.cost"", ""0.home.specifications""]"
