,phrase,intents
456,No. I no longer need the services and have previously requested that your company stop contacting me.,"[""2.dnc"", ""0.negation"", ""2.not.interested""]"
457,"Hi, I'm interested but currently working. Is there anyway you can email me a quote with just the basic system?","[""0.send.info"", ""0.delay.work"", ""1.is.interested""]"
458,"Hi,
Can you give me a quote for only internal, external cameras and door bell? Also, do you have wireless indoor cameras?","[""0.specific.equipment.cost"", ""0.send.quote""]"
459,I'm not making a phone call. I need a quote via text or email. If you can't do this then delete my number.,"[""0.text.only"", ""0.send.info""]"
460,"When I  talked to one of your representatives for outdoor security, the price of $60 plus  per month was too much. So there is no need to keep  texting unless you can provide that for me for less than 30 per month.","[""2.transfer.success"", ""2.cost.too.high""]"
461,"If you have a deal that includes no payment for the first month I will take it. Otherwise, I can't do it at this time","[""0.cost.demand"", ""2.future.interest""]"
462,"Is it possible to send a quote for the doorbell camera, 1 outside camera for the back, motion sensor and glass break?  We have 4 doors that need sensors. 2 sliders, garage and front door","[""0.specific.equipment.cost"", ""0.home.specifications""]"
463,I would need to pay for equipment with monthly bill. If I can't do that I'm not interested. I'm on Disability and afford the up front cost,"[""0.cost.demand"", ""0.buy.equipment""]"
464,Hi [NAME_1]. I'm currently out of town and will be back in [LOCATION_1] on Monday. Can we set up a time to talk then.,"[""1.schedule.call.day_n_time"", ""0.greeting""]"
465,"I don't have a specific price in mind I'm just wondering what your base price would be so I know if it's competitive to what I have now I'd like to spend around $40 can you please tell me what your lowest package prices are and we can go from there. 

As I just said I don't have phone service at my house I need to go out to make phone calls. Can you just text me the base price so I know if we should move forward or if this is totally out of range -thank you","[""0.cost.demand"", ""0.text.only"", ""0.what.does.it.cost""]"
466,Thank you I'm still interested but I received pricing from an agent and was told I did have to put money down to start. I was interested in the zero down insulation and start up but that's not what he told me. He also quoted me $80 or so a month in monitoring charges which I think it's just too much,"[""2.cost.too.high"", ""2.transfer.success"", ""1.is.interested""]"
467,"So why would your people tell me it's a requirement? 
Even after I said I would pay for the equipment up front.","[""0.misunderstood"", ""0.buy.equipment""]"
468,Just visited with your representative. Thank you for your time please remove me from your contact list.,"[""2.dnc"", ""2.transfer.success""]"
469,I'm sorry I'm available right now I had been in a meeting earlier and turn the volume on my ringer down so I didn't hear the phone ringing please give me a call,"[""1.call.now"", ""0.apology""]"
470,"Hey with great credit what is the average monthly bill? I would need door bell, 2 thermostats, indoor camera, motion sensor, door sensor and glass break sensor.","[""0.specific.equipment.cost"", ""0.what.does.it.cost""]"
471,"Hi, it was on an inquiry... i wasn't sure and i wanted to know prices. Right now I'm at work and don't really have the time to talk.","[""0.delay.evaluating"", ""0.delay.work""]"
472,[NAME_1] with this offer of a free installation what is your cheapest setup 4 senior citizens? I live in [LOCATION_1] do you service us.,"[""0.promo.info"", ""0.free.install""]"
473,"[NAME_1], the price was way too high but I also think the estimate included way more than I'm looking for... for example, I don't need alarms on all first floor windows.  I'm happy to discuss but would like you to send me an Inventory of the hardware quoted: [EMAIL_ADDRESS_1]","[""0.send.info"", ""0.specific.equipment.cost"", ""2.cost.too.high""]"
474,"I won't beg your company for a quote. If I can't get one via email, then remove me from your call list","[""2.dnc"", ""0.send.info""]"
475,Im at the hospital i have a procedure to be done . They going to take me in five minutes. I have my daughter call you around [PHONE_NUMBER_1],"[""1.schedule.call.day_n_time"", ""0.delay.sick""]"
476,I have begged your company to stop bothering me please stop texting calling or emailing me I am not interested at all,"[""2.dnc"", ""2.not.interested""]"
477,I am not I treat in your products...the monthly cost is more than I care to spend..I don't need monitoring...I will go with local storage instead.  Thanks...,"[""2.not.interested"", ""2.cost.too.high"", ""2.chose.competitor""]"
478,I am currently having my home assessed for sale and have postponed purchasing a home security system. I retained your company's contact information and will look again for home security once settled at a new location. There is no need for you to contact me again. Thank you and have a great day.,"[""2.future.interest"", ""2.dnc""]"
479,Greetings [NAME_1]. We are looking to move and no longer interested in the investment for this home. We will circle back in our new home. Thanks.,"[""2.future.interest"", ""0.greeting"", ""2.not.interested""]"
480,"I already met with your local [OCCUPATION_1] (door to door) and your system is double what I am paying for Frontpoint. Unless you can match or beat their monthly fee, I can not see switching","[""2.transfer.success"", ""2.cost.too.high""]"
481,"I pay $[MONEY_1] a month. 2 indoor cameras, 1 outdoor camera, door bell camera, 10 sensors, smoke/carbon monoxide detector. I spoke to your [OCCUPATION_1] and the best he could do was $[MONEY_2] month for 5 years then $[MONEY_3] after","[""0.cost.demand"", ""0.specific.equipment.cost""]"
482,"I'm not looking for ""specific"" equipment. This is what I have with Frontpoint already at $[MONEY_1] a month. If you can replace it with yours for a equal or better price I will switch","[""0.misunderstood"", ""0.cost.demand""]"
483,Yes but I don't have time currently.....looking for basic service for fire protection for my home insurance.  How much will that be,"[""0.what.does.it.cost"", ""0.delay.hours""]"
484,"Hello!
I'm looking at other options at this time because I'm a little disappointed in VIVINT. I was denied getting a doorbell camera because I didn't have good credit. I didn't know one has to have good credit to secure their homes. That's really absurd. I'm more than capable of paying $[MONEY_1] a month. It's not like I'm financing a car here. Like come on!","[""0.delay.evaluating"", ""0.greeting""]"
485,"Hi..

Unfortunately not able to talk right now..

However I just want to know, we already have a ring doorbell/camera system.. 

I just wanted to inquire what vivint charges monthly.  We already have a system in our home, looking to shop around for better deals

Thank you","[""0.existing.system"", ""0.greeting"", ""0.delay.hours"", ""0.what.does.it.cost""]"
486,"Hi [NAME_1]. I will have to postpone getting a security system. I seem to have a problem with WiFi as my smart thermostat,sprinklers camera aren't working. I'll contact you if I get these working.","[""2.future.interest"", ""0.delay.conditional"", ""0.greeting""]"
487,"Hi [NAME_1], what specials do you have running currently for vivint? Needing a quote when you have a moment","[""0.promo.info"", ""0.greeting"", ""0.send.quote""]"
488,In my opinion it should be free install and free for 6 months to see if it is right for us. If thats something you can do id really consider it,"[""0.cost.demand"", ""0.free.install""]"
489,We are currently packing and loading the old home prior to moving into the new one we are looking to install home security in. Tomorrow late morning or early afternoon would work for me,"[""1.schedule.call.day_n_time"", ""0.delay.new.house""]"
490,Please take me off of this list. I received a call at 11 pm last night. I went with another provider. Thanks!,"[""2.dnc"", ""2.chose.competitor""]"
491,The other option is for half of what we wanted and we had to install ourselves through our doorbell. And my husband is not handy so I cant do that.,"[""0.cost.demand"", ""0.free.install""]"
492,I was told the amount needed to start and I don't have it and Im assuming my credit is not high enough to get it so I'm just going to have to pass for now but Thank you anyway,"[""2.future.interest"", ""2.needs.income""]"
493,Sorry I had to take care of a family member I am interested in secutg syse. For a  1000 sq feet with a night. Amera for a front door  wi to h a total cost not to exceed 50 dollars  per month  for or equipm to [LOCATION_1],"[""0.cost.demand"", ""1.is.interested"", ""0.apology"", ""0.home.specifications""]"
494,"This is not [NAME_1]. I have had this number for almost 15 years and he still continues to use it on everything he signs up for. I have had debt collectors calling for him, lawyers calling for him and solicitors. Nothing against you or your company but please remove my number from his contact information. Thanks.","[""2.dnc"", ""2.wrong.number""]"
495,I am still interested but I'm discussing it with my wife on what exactly we need because we don't really need window sensors because we have dogs,"[""0.delay.evaluating"", ""1.is.interested""]"
496,"I already have the system installed, it was here when I bought the house... I am interested in a service call to check all components of the system and wanting the price for the system operating ...","[""0.existing.system"", ""0.what.does.it.cost""]"
497,I gave told several people from giving that I am not interested. Please stop these constant texts and calls.,"[""2.dnc"", ""2.not.interested""]"
498,"Hello. I live in a rented house that is already a smart home. But I was looking into door bell cameras. Soo I made a mistake. 
Thank you.","[""0.specific.equipment.cost"", ""0.greeting"", ""0.apology""]"
499,"Hello, 
I reviewed some of the packages [ORGANIZATION_1] has to offer and with buying a new home-funds can be a little low. Therefore, I have prioritized the idea away and may just go with another company. I currently use [ORGANIZATION_2], but I am interested in a real-time doorbell camera for my front door and would like another indoor camera. The entire system itself-is too expensive for me at the moment.","[""0.specific.equipment.cost"", ""0.greeting"", ""2.needs.income""]"
500,"Good morning. Everything went well, thanks for asking. I'm currently working. Around [TIME_1] will work for a phone call.","[""0.confirmation"", ""1.schedule.call.day_n_time"", ""0.greeting"", ""0.delay.work""]"
501,I am but not this time as my sister just passed away Wednesday morning please contact me after Thanksgiving thank you and bless you🙏✝️🙏,"[""0.delay.funeral"", ""0.confirmation"", ""1.schedule.call.day_n_time""]"
502,"As I explained to one of your associates that requested a deposit to secure an appointment for an estimate and demonstration in my home, I do not and will not pay such a ridiculous fee.","[""2.transfer.success"", ""2.cost.too.high""]"
503,Thank [NAME_1]. I appreciate you reaching out but I'm not interested right now. Could I please be removed from the list and not receive more contacts?,"[""2.future.interest"", ""0.confirmation"", ""2.dnc""]"
504,"Good Morning! This is my only day off. Please DO NOT CALL IN THE AM, WOKE THE BABY! I WILL REACH OUT WHEN I HAVE TIME TO SPEAK WITH YOU! THANK YOU!","[""0.delay.will.reply"", ""0.greeting""]"
505,"I'm currently looking into other vendors that may ha e better offering. Looking to pay for only monitoring, $[MONEY_1] per month. Not willing to pay for equipment.","[""0.cost.demand"", ""0.delay.evaluating""]"
506,"Sorry I'm sorry, yes I am still interested in the Alarm System. I would like to know what's the best offer you can give me for my condo","[""0.promo.info"", ""1.is.interested"", ""0.apology""]"
507,"Their water detection i have under the kitchen sink failed because they didnt have it mounted correctly and i had a huge problem.  They told me they couldn't come out for a week to check their system, so i told them i wanted to cancel.  They came out the next dsy. Terrible customer service.","[""0.courtesy.or.statement"", ""0.negative.call.center.experience""]"
508,"This offer has been with me for a while, free installation that is. Its the monthly charges that are high, and the long contracts.

Call me in 15 minutes and we can talk.","[""0.free.install"", ""2.cost.too.high""]"
509,No...I concerned about the cost of your equipment...I didn't realize that I would need to purchase everything.,"[""0.negation"", ""0.buy.equipment""]"
510,I didn't Qualify for the program I had to pay out of pocket and I don't have that kind of cash with me,"[""2.not.eligible"", ""2.needs.income""]"
511,"When I recently talked to a vivint agent, all I want. It's the panel, and 4 cameras. I was quoted almost $3,000","[""0.specific.equipment.cost"", ""2.transfer.success""]"
512,"Hello [NAME_1], sorry to inform you but I am not interested in going with Vivint anymore. When I was talking to one of the guys about what I wanted, which was the panel, and 3 to 4 cameras, I was quoted almost $3,000. Thats ridiculous. I'm with ADT and I would have to pay and arm and leg for just 3 cameras being around $600 for all three. How it world, would I have to pay that much with Vivint? It would be cheaper for me to run my own security system. Either closed network or WiFi and encrypt it. For less then $300. So what about Vivint makes it worth $3,000? In no way am I trying to be rude towards you or your company. I'm just curious.","[""2.transfer.success"", ""0.greeting"", ""2.cost.too.high"", ""2.not.interested""]"
513,"No one has sold me on vivint. What makes it so special? I want to know. Why should I go with your company, when I can keep adt, and install my own cameras and still pay less then what one of your cameras is worth?","[""0.cost.demand"", ""0.how.does.it.work""]"
514,"Here's my issue, if I need a financing option for my security system. That's a problem. The cameras you guys go with have to be over $500 a piece and the the panel is a smaller version of a android tablet. What so expensive? I understand equipment is expensive. But when I can buy a tablet, 6 cameras myself. And pay less than $1000, why should I go with your company? I pay less that $60 a month for ADT and they gave me a free camera and the panel. And the install was free. And I get my own equipment and still have the security I wanted, for less then one of your cameras.","[""0.cost.demand"", ""0.free.install"", ""2.cost.too.high""]"
515,I already have system installed in my house by previous owner. I had a call from Vivint last week but the monthly price is very high. If I can get monthly price down to 35 dollars or less then I can think of switching it to Vivint. Thanks,"[""0.cost.demand"", ""0.existing.system""]"
516,"Hi I am currently at work, what is the limited offer? We just moved in this year and looking for a good system.","[""0.promo.info"", ""1.is.interested"", ""0.delay.work""]"
517,I spoke to someone over the phone with vivint sounds like a fair option just waiting to close on our house in [LOCATION_1],"[""2.transfer.success"", ""0.delay.new.house""]"
518,Ok thank you have a nice day merry Christmas and happy holiday I'll have to pass at this time thank you so much,"[""0.courtesy.or.statement"", ""0.confirmation"", ""2.future.interest""]"
519,"i'm sorry that was an accident, i didn't know that text was sent. i spoke with someone last night & they will reach back out in january.","[""2.transfer.success"", ""0.apology""]"
520,I just have the fee that be asked before text come. Im still interest but Chriatmas has got me right now for any upfront pay outs,"[""0.what.does.it.cost"", ""1.is.interested""]"
521,I already got a quote i we plan on going ahead with it but we would like to just get past the holidays before we go ahead and pay for it. But is there anyway that you could tell me how much extra the smart garage would be to add on,"[""0.specific.equipment.cost"", ""2.transfer.success""]"
522,"Good morning,  I haven't started lfor one until I'm  ready to get my house.  And that won't be til next year.","[""2.future.interest"", ""0.greeting""]"
523,"Your prices were way too high. I already have a system in place, and was quoted thousands of dollars to add ""additional"" equipment. Not interested.","[""0.existing.system"", ""2.not.interested"", ""2.cost.too.high""]"
524,Hi [NAME_1] i would appreciate if [NAME_2] not contact me any longer. I already mentioned i was not interested.,"[""2.dnc"", ""2.not.interested""]"
525,I am not interested in this. My grandbaby plays with my phone. She evidently pushed something. Sorry!!,"[""0.courtesy.or.statement"", ""2.not.interested"", ""0.apology""]"
526,"I went with ring. It was too expensive with you guys. Please take me off your call, email and text message list.","[""2.dnc"", ""2.cost.too.high"", ""2.chose.competitor""]"
527,I am interested in 3 camera system. I got your number from a family member. She was given a great price.,"[""0.courtesy.or.statement"", ""0.specific.equipment.cost""]"
528,I purchased a home that already has a [ORGANIZATION_1] system. When I called to inquire on activating it. The [OCCUPATION_1] didn't understand abs tried to sell me a new system with installation fees etc. I want to know the cost to reactivate what is already there. And costs for additional options to add to the current t system. And if y'all offer discounts for [OCCUPATION_2].,"[""0.promo.info"", ""0.existing.system"", ""0.what.does.it.cost""]"
529,"Good evening [NAME_1], I saw your text earlier however I have been busy working lol

As for my needs I'd absolutely love to have this system but I just sold my house. Going to be living in an apartment here for 10 months or less then buying another house.

If I decide to go with this system it would be $50 monthly?  Also, would it be able to be installed into my apt for 10ish months then transferred to my house or how does the process work? 

We can definitely talk in the phone tomorrow if you'd like - I have a layover in [LOCATION_1] for work. So I'm free most of the day. Please just get back to me and we can arrange a time :)","[""0.what.does.it.cost"", ""1.is.interested"", ""1.schedule.call.day_n_time"", ""0.greeting"", ""0.delay.work"", ""0.cost.demand""]"
530,Hi. We asked if we could buy up front the material but did not receive any answer. Right now your monthly fees are 3 times more expensive than others. Can we self monitoring our own system without monthly fees/contract? Thank you,"[""0.misunderstood"", ""0.no.monitoring"", ""2.cost.too.high"", ""0.buy.equipment""]"
531,"We want to know if we can buy the material instead of having a monthly fee, and stay with a self monitoring.","[""0.no.monitoring"", ""0.buy.equipment""]"
532,I just want to monitor the windows door bell and front door and back door setup and monthly bill how much,"[""0.specific.equipment.cost"", ""0.what.does.it.cost""]"
533,I tried calling the number and it says application error. Call me at [PHONE_NUMBER_1]. I'm available to talk right now,"[""0.system.error"", ""1.call.now""]"
534,Hello. I didn't qualify for the system. I would have to pay all up front. I'm not able to at the moment,"[""2.not.eligible"", ""2.needs.income""]"
535,I'm going to need to reschedule my son broke his arm and we are at children's hospital. Maybe for Tuesday around 1 pm,"[""0.delay.family.sick"", ""1.schedule.call.day_n_time""]"
536,"Still haven't decided, i live in a very secure condo, debating if i even need a security system!! Per month is the BIGGEST thing!,,, how much it's gonna cost me and probably never need it...  thanks for you staying on top of it however!.","[""0.delay.evaluating"", ""0.what.does.it.cost""]"
537,"Gosh, I sent a text to [NAME_1] stating not at this time. So, please do not text me anymore. Thank you [NAME_2].","[""2.future.interest"", ""2.dnc""]"
538,Yes I would love to be apart of the [NAME_1] family but I can not afford a down payment at this time,"[""2.needs.income"", ""1.is.interested""]"
539,"2 door sensors, 7 window sensors 2outdoor cameras keypad and possible outdoor siren?? Monthly charge and 0$ at installation right?","[""0.free.install"", ""0.specific.equipment.cost"", ""0.what.does.it.cost"", ""0.home.specifications""]"
540,"But if can't give me cost nevermind. Need what's due at installation, monthly fee and all equipment included","[""0.free.install"", ""0.send.quote"", ""0.buy.equipment""]"
541,"I need a price on the system and monthly charges with out a credit check first, I don't mind a credit check but I need pricing first. I would be paying cash for the system.","[""0.what.does.it.cost"", ""0.buy.equipment""]"
542,Hi! Sorry I haven't been available...I've been working a lot. I'll be home today around 5...would that work?,"[""1.schedule.call.day_n_time"", ""0.delay.work"", ""0.apology""]"
543,"you guys have blown up my phone, which is why i havent answered. i inquired online but i dont need you to nag me every day!! this is absolutely ridiculous. no i do not want your services.","[""2.not.interested"", ""0.excessive.contact""]"
544,"Can you give me an idea of cost for monitoring and lock controls?  Also, what sort of discounts are available?","[""0.promo.info"", ""0.what.does.it.cost""]"
545,Hello. Yes I can't get the system right now because they said my score wasn't high enough when they did credit check,"[""2.future.interest"", ""0.greeting"", ""2.credit.denied""]"
546,Hi [NAME_1]. Can we talk tomorrow. We are in the process of buying a new home. Waiting to make sure we are moving forward,"[""1.schedule.call.day_n_time"", ""0.greeting"", ""0.delay.new.house""]"
547,"I will be in touch, I am still shopping around and haven't decided on anything just yet. $60 per month is a little steep for me at this point in time.","[""0.delay.will.reply"", ""2.cost.too.high""]"
548,Everything works just didn't want to resume the previous owners contract. I am looking for a month to month not a long term contract with vivint. Can you give me an estimate for just the monitoring without contract through text or email ? Then I'll decide whether or not to move forward with phone call to rep etc..,"[""0.about.contract"", ""0.existing.system"", ""0.send.info""]"
549,"I have a home security system, been wanting the camera doorbells, just wondering how much per month !","[""0.specific.equipment.cost"", ""0.what.does.it.cost"", ""2.has.product""]"
550,"Hi [NAME_1]-
Sorry, I have been busy as we just closed on our house. 
I have all doors and windows wired here as the pre ious owner had ADT. I will just need the panel and regular monthly monitoring. I have 2 motion sensors already installed. Just need the panel and monthly monitoring. Please give me a fresh quote. Thx","[""0.greeting"", ""0.home.specifications"", ""0.delay.new.house"", ""0.send.quote""]"
551,I am interested in the options that Vivint offers. Im currently at work until 6pm. Off tomorrow and have more time to talk. What time would be good?,"[""0.delay.work"", ""1.schedule.call.day_n_time"", ""1.is.interested""]"
552,"Sure. Give me a call tomorrow. The thing is, I have already looked in to [ORGANIZATION_1] and I think they are more in line with what I can afford","[""0.confirmation"", ""1.schedule.call.day_n_time"", ""0.delay.evaluating""]"
553,I have no interest. Don't know how you got my information. Don't want to system. I already told you stop. Take me off the list.,"[""2.dnc"", ""2.not.interested""]"
554,"I would need to see The hardware you intend to use and have the choices in person before I commit to the [MONEY_1] upfront and then the monthly security so if you can have someone come out and actually look at my house and show me what you have I'm absolutely able to go forward with them I'll even pay whatever the inspection fee is in case I don't go with it but I need to see it this is a [DATE_1] in [LANGUAGE_1] the house I just spent over 60,000 on a new roof and I really don't want to have ugly locks and he's all doors so yes I'm going to go forward but I need you to have someone come out and show me what you have","[""1.is.interested"", ""0.home.specifications""]"
555,We just communicated yesterday! I was specific about contacting me after [DATE_1]. How is it that you're reaching out that day after we already established this [NAME_1]?,"[""1.schedule.call.day_n_time"", ""2.transfer.success""]"
556,"Not interested right now.
I am looking at a company where equipment is free as is install
Thanks anyways","[""2.future.interest"", ""0.cost.demand""]"
557,"I'm going with a [ORGANIZATION_1] system. Please stop texting and calling. If it doesn't work out, I will be in touch. Thank you.","[""2.dnc"", ""0.delay.conditional"", ""2.chose.competitor""]"
558,Hello. I was looking for service pricing. I am currently under contract on my first home and shopping around at this point,"[""0.greeting"", ""0.what.does.it.cost"", ""2.in.contract""]"
559,"I'm sorry, thank you for reaching out but your more than what we are intending to pay. It's a little out of our budget.","[""2.needs.income"", ""2.cost.too.high"", ""0.apology""]"
560,I'm a DTH [ORGANIZATION_1] [OCCUPATION_1]. I don't know why you guys keep contacting me. Please take me off the list,"[""2.dnc"", ""2.wrong.number""]"
561,I'm no longer interested at this time. Thanks for reaching out. Please kindly remove and opt me out from your calling/texting system.,"[""2.future.interest"", ""0.courtesy.or.statement"", ""2.dnc""]"
562,Sorry for the late response. We are on the process in closing a house and may be in the market for security systems by [DATE_1] at the earliest.,"[""1.schedule.call.day_n_time"", ""0.delay.new.house"", ""0.apology""]"
